{
  "schemaVersion": "1.0",
  "id": "opencode",
  "label": "opencode",
  "aliases": [],
  "docsUrl": "https://opencode.ai/docs/skills",
  "docsVerifiedOn": "2026-10-15",
  "kind": "skill",
  "project": ".agents/skills/frontend-craft",
  "user": ".agents/skills/frontend-craft",
  "frontmatter": null,
  "detectMarkers": [
    ".opencode",
    "opencode.json"
  ],
  "nativeSkillSupport": true,
  "notes": "opencode reads .opencode/skills/, .agents/skills/ and .claude/skills/ (and the matching user directories).",
  "caveats": [
    "If Claude Code is installed too, this agent may also read .claude/skills/ and list the skill twice."
  ]
}
