{
  "schemaVersion": "1.0",
  "id": "cursor",
  "label": "Cursor",
  "aliases": [],
  "docsUrl": "https://cursor.com/help/customization/skills",
  "docsVerifiedOn": "2026-10-15",
  "kind": "skill",
  "project": ".agents/skills/frontend-craft",
  "user": ".agents/skills/frontend-craft",
  "frontmatter": null,
  "detectMarkers": [
    ".cursor",
    ".cursorrules"
  ],
  "nativeSkillSupport": true,
  "notes": "Cursor reads .cursor/skills/ and .agents/skills/ (plus .claude/skills/ and .codex/skills/ for compatibility). Project rules (.cursor/rules/*.mdc) are not needed when skills load natively.",
  "caveats": [
    "Docs were read through a summarizing web fetch, not verbatim; re-check before quoting.",
    "If Claude Code is installed too, this agent may also read .claude/skills/ and list the skill twice."
  ]
}
