{
  "schemaVersion": "1.0",
  "id": "copilot",
  "label": "GitHub Copilot",
  "aliases": [
    "github-copilot"
  ],
  "docsUrl": "https://docs.github.com/en/copilot/concepts/agents/about-agent-skills",
  "docsVerifiedOn": "2026-10-15",
  "kind": "skill",
  "project": ".agents/skills/frontend-craft",
  "user": ".agents/skills/frontend-craft",
  "frontmatter": null,
  "detectMarkers": [
    ".github/copilot-instructions.md",
    ".github/instructions",
    ".github/skills"
  ],
  "nativeSkillSupport": true,
  "notes": "Copilot (CLI, cloud agent, VS Code, JetBrains) reads .github/skills/, .claude/skills/ and .agents/skills/; user ~/.copilot/skills/ and ~/.agents/skills/.",
  "caveats": [
    "If Claude Code is installed too, this agent may also read .claude/skills/ and list the skill twice."
  ]
}
